НАИМЕНОВАНИЕ;АРТИКУЛ;ИМЯ_БРЕНДА;СТРАНА_БРЕНДА;РАЗДЕЛ;КАТЕГОРИЯ;ЦЕНА;ИЗОБРАЖЕНИЕ;КОЛЛЕКЦИЯ;ОПИСАНИЕ;ХАРАКТЕРИСТИКИ
Торшер Freya Driana FR2405-FL-01-BZ;FR2405-FL-01-BZ;Freya;Германия;Торшеры;С 1 плафоном;19990;https://www.vamsvet.ru/upload/iblock/c78/vamsvet-torsher-freya-driana-fr2405-fl-01-bz.jpeg|https://www.vamsvet.ru/upload/iblock/c6c/torsher-freya-driana-fr2405-fl-01-bz-1.jpeg|https://www.vamsvet.ru/upload/iblock/0bb/torsher-freya-driana-fr2405-fl-01-bz-2.jpeg|https://www.vamsvet.ru/upload/iblock/f32/torsher-freya-driana-fr2405-fl-01-bz-3.jpeg|https://www.vamsvet.ru/upload/iblock/465/torsher-freya-driana-fr2405-fl-01-bz-4.jpeg|https://www.vamsvet.ru/upload/iblock/910/torsher-freya-driana-fr2405-fl-01-bz-5.jpeg|https://www.vamsvet.ru/upload/iblock/c78/vamsvet-torsher-freya-driana-fr2405-fl-01-bz.jpeg|https://www.vamsvet.ru/upload/iblock/c6c/torsher-freya-driana-fr2405-fl-01-bz-1.jpeg|https://www.vamsvet.ru/upload/iblock/0bb/torsher-freya-driana-fr2405-fl-01-bz-2.jpeg|https://www.vamsvet.ru/upload/iblock/f32/torsher-freya-driana-fr2405-fl-01-bz-3.jpeg|https://www.vamsvet.ru/upload/iblock/465/torsher-freya-driana-fr2405-fl-01-bz-4.jpeg|https://www.vamsvet.ru/upload/iblock/910/torsher-freya-driana-fr2405-fl-01-bz-5.jpeg;Driana;Непревзойденная модель FR2405-FL-01-BZ от немецкой компании Freya относится к коллекции Driana и отлично подойдет для установки на пол спальни, оформленной в стиле флористика. Торшер Freya Driana FR2405-FL-01-BZ с конусными плафонами осветит помещение площадью 2.2 кв. м. Производитель Freya рекомендует использовать для устройства лампы накаливания с цоколем E14 и мощностью 40 W. Прибор произведен с использованием материалов: текстиль, металл и органза. Основным цветом товара является бежевый и бронзовый. Торшер FR2405-FL-01-BZ продается по цене 19990 руб. Торопитесь сделать заказ в интернет-магазине ВамСвет.;Артикул:FR2405-FL-01-BZ||Бренд:Freya||Страна бренда:Германия||Коллекция:Driana||Стиль:Флористика||Высота, мм:1583||Диаметр, мм:382||Тип цоколя:E14||Тип лампочки (основной):Накаливания||Количество ламп:1||Мощность лампы, W:40||Общая мощность, W:40||Площадь освещения, м2:2.2||Напряжение, V:220-240||Виды материалов:Текстильные||Материал арматуры:Металл||Материал плафонов:Органза||Вид рассеивателя:Абажур||Форма рассеивателя:Конусный||Цвет:Бежевый||Цвет арматуры:Бронза||Цвет плафонов:Бежевый||Степень защиты:IP20||Интерьер:Для спальни||Место установки:На пол||Пульт ДУ:Нет||Гарантия производителя:12 месяцев||Гарантия магазина:12 месяцев||Раздел:Торшеры||Каталог:С 1 плафоном
Торшер Freya Nubi FR5134-FL-01-BG;FR5134-FL-01-BG;Freya;Германия;Торшеры;С 1 плафоном;27590;https://www.vamsvet.ru/upload/iblock/532/vamsvet-torsher-freya-nubi-fr5134-fl-01-bg.jpeg|https://www.vamsvet.ru/upload/iblock/527/torsher-freya-nubi-fr5134-fl-01-bg-1.jpeg|https://www.vamsvet.ru/upload/iblock/a7f/torsher-freya-nubi-fr5134-fl-01-bg-2.jpeg|https://www.vamsvet.ru/upload/iblock/4a6/torsher-freya-nubi-fr5134-fl-01-bg-3.jpeg|https://www.vamsvet.ru/upload/iblock/532/vamsvet-torsher-freya-nubi-fr5134-fl-01-bg.jpeg|https://www.vamsvet.ru/upload/iblock/527/torsher-freya-nubi-fr5134-fl-01-bg-1.jpeg|https://www.vamsvet.ru/upload/iblock/a7f/torsher-freya-nubi-fr5134-fl-01-bg-2.jpeg|https://www.vamsvet.ru/upload/iblock/4a6/torsher-freya-nubi-fr5134-fl-01-bg-3.jpeg;Nubi;Восхитительная модель FR5134-FL-01-BG от немецкой компании Freya относится к коллекции Nubi и отлично подойдет для установки на пол в гостиной, оформленной в стиле кантри. Торшер Freya Nubi FR5134-FL-01-BG с конусными плафонами осветит помещение площадью 2.2 кв. м. Производитель Freya рекомендует использовать для устройства лампы накаливания с цоколем E27 и мощностью 40 W. Прибор произведен с использованием материалов: дерево и ткань. Основным цветом товара является бежевый. Торшер FR5134-FL-01-BG продается по цене 27590 руб. Торопитесь сделать заказ в интернет-магазине ВамСвет.;Артикул:FR5134-FL-01-BG||Бренд:Freya||Страна бренда:Германия||Коллекция:Nubi||Стиль:Кантри||Высота, мм:1600||Диаметр, мм:425||Тип цоколя:E27||Тип лампочки (основной):Накаливания||Количество ламп:1||Мощность лампы, W:40||Общая мощность, W:40||Площадь освещения, м2:2.2||Напряжение, V:220-240||Виды материалов:Деревянные||Материал арматуры:Дерево||Материал плафонов:Ткань||Вид рассеивателя:Абажур||Форма рассеивателя:Конусный||Цвет:Бежевый||Цвет арматуры:Бежевый||Цвет плафонов:Бежевый||Степень защиты:IP20||Интерьер:Для гостиной||Место установки:На пол||Пульт ДУ:Нет||Гарантия производителя:12 месяцев||Гарантия магазина:12 месяцев||Раздел:Торшеры||Каталог:С 1 плафоном
Торшер TK Lighting 1092 lozano 1;1092 lozano 1;TK Lighting;Польша;Торшеры;Со столиком;23500;https://www.vamsvet.ru/upload/iblock/53a/vamsvet-torsher-tk-lighting-1092-lozano-1.jpeg;Lozano;Потрясающая модель 1092 lozano 1 от польской компании TK Lighting относится к коллекции Lozano и отлично подойдет для установки на пол кафе и ресторанов, оформленных в стиле кантри. Торшер TK Lighting 1092 lozano 1 с пирамидальными плафонами осветит помещение площадью 4 кв. м. Производитель TK Lighting рекомендует использовать для устройства лампы накаливания с цоколем E27 и мощностью 60 W. Прибор произведен с использованием материалов: дерево, металл и ткань. Основным цветом товара является коричневый, хромовый и белый. Торшер 1092 lozano 1 продается по цене 23500 руб. Торопитесь сделать заказ в интернет-магазине ВамСвет.;Артикул:1092 lozano 1||Бренд:TK Lighting||Страна бренда:Польша||Страна производства:Польша||Коллекция:Lozano||Стиль:Кантри||Ширина, мм:400||Высота, мм:1480||Длина, мм:400||Тип цоколя:E27||Тип лампочки (основной):Накаливания||Количество ламп:1||Мощность лампы, W:60||Общая мощность, W:60||Напряжение, V:220-240||Виды материалов:Деревянные||Материал арматуры:Металл||Материал плафонов:Ткань||Вид рассеивателя:Абажур||Форма рассеивателя:Пирамида||Цвет:Коричневый||Цвет арматуры:Хром||Цвет плафонов:Белый||Степень защиты:IP20||Интерьер:Для кафе и ресторанов||Место установки:На пол||Пульт ДУ:Нет||Срок службы:6 лет||Гарантия производителя:12 месяцев||Гарантия магазина:12 месяцев||Раздел:Торшеры||Каталог:Со столиком
Торшер Arte Lamp Elba A2581PN-1AB;A2581PN-1AB;Arte Lamp;Италия;Торшеры;С 1 плафоном;11990;https://www.vamsvet.ru/upload/iblock/d94/vamsvet-torsher-arte-lamp-elba-a2581pn-1ab.jpeg|https://www.vamsvet.ru/upload/iblock/dbb/torsher-arte-lamp-elba-a2581pn-1ab-1.jpeg|https://www.vamsvet.ru/upload/iblock/a7e/torsher-arte-lamp-elba-a2581pn-1ab-2.jpeg|https://www.vamsvet.ru/upload/iblock/686/torsher-arte-lamp-elba-a2581pn-1ab-3.jpeg|https://www.vamsvet.ru/upload/iblock/34c/torsher-arte-lamp-elba-a2581pn-1ab-4.jpeg|https://www.vamsvet.ru/upload/iblock/d94/vamsvet-torsher-arte-lamp-elba-a2581pn-1ab.jpeg|https://www.vamsvet.ru/upload/iblock/dbb/torsher-arte-lamp-elba-a2581pn-1ab-1.jpeg|https://www.vamsvet.ru/upload/iblock/a7e/torsher-arte-lamp-elba-a2581pn-1ab-2.jpeg|https://www.vamsvet.ru/upload/iblock/686/torsher-arte-lamp-elba-a2581pn-1ab-3.jpeg|https://www.vamsvet.ru/upload/iblock/34c/torsher-arte-lamp-elba-a2581pn-1ab-4.jpeg;Elba;Изящная модель A2581PN-1AB со встроенным выключателем от итальянской компании Arte Lamp относится к коллекции Elba и отлично подойдет для установки на пол спальни, оформленной в современном стиле. Торшер Arte Lamp Elba A2581PN-1AB с конусными плафонами осветит помещение площадью 3.3 кв. м. Производитель Arte Lamp рекомендует использовать для устройства лампы накаливания с цоколем E27 и мощностью 60 W. Прибор произведен с использованием материалов: текстиль, металл и ткань. Основным цветом товара является белый и античная бронза. Торшер A2581PN-1AB продается по цене 11990 руб. Торопитесь сделать заказ в интернет-магазине ВамСвет.;Артикул:A2581PN-1AB||Бренд:Arte Lamp||Страна бренда:Италия||Страна производства:Китай||Коллекция:Elba||Стиль:Современный||Высота, мм:1500||Диаметр, мм:380||Тип цоколя:E27||Тип лампочки (основной):Накаливания||Количество ламп:1||Мощность лампы, W:60||Общая мощность, W:60||Площадь освещения, м2:3.3||Напряжение, V:220-240||Виды материалов:Текстильные||Материал арматуры:Металл||Материал плафонов:Ткань||Вид рассеивателя:Абажур||Форма рассеивателя:Конусный||Цвет:Белый||Цвет арматуры:Античная бронза||Цвет плафонов:Белый||Степень защиты:IP20||Интерьер:Для спальни||Место установки:На пол||Наличие выключателя:Да||Гарантия производителя:12 месяцев||Гарантия магазина:12 месяцев||Раздел:Торшеры||Каталог:С 1 плафоном
Торшер Divinare Nova 3001/02 PN-6;3001/02 PN-6;Divinare;Италия;Торшеры;С 1 плафоном;79990;https://www.vamsvet.ru/upload/iblock/f80/vamsvet-torsher-divinare-nova-3001-02-pn-6.jpeg|https://www.vamsvet.ru/upload/iblock/603/torsher-divinare-nova-3001-02-pn-6-1.jpeg|https://www.vamsvet.ru/upload/iblock/f80/vamsvet-torsher-divinare-nova-3001-02-pn-6.jpeg|https://www.vamsvet.ru/upload/iblock/603/torsher-divinare-nova-3001-02-pn-6-1.jpeg;Nova;Исключительная модель 3001/02 PN-6 от итальянской компании Divinare относится к коллекции Nova и отлично подойдет для установки на пол больших залов, оформленных в современном стиле. Торшер Divinare Nova 3001/02 PN-6 с декоративными плафонами осветит помещение площадью 16 кв. м. Производитель Divinare рекомендует использовать для устройства лампы накаливания с цоколем E14 и мощностью 40 W. Прибор произведен с использованием материалов: хрусталь и металл. Основным цветом товара является хромовый и прозрачный. Торшер 3001/02 PN-6 продается по цене 79990 руб. Торопитесь сделать заказ в интернет-магазине ВамСвет.;Артикул:3001/02 PN-6||Бренд:Divinare||Страна бренда:Италия||Страна производства:Китай||Коллекция:Nova||Стиль:Современный||Высота, мм:1600||Диаметр, мм:500||Тип цоколя:E14||Тип лампочки (основной):Накаливания||Количество ламп:6||Мощность лампы, W:40||Общая мощность, W:240||Напряжение, V:220-240||Виды материалов:Хрустальные||Материал арматуры:Металл||Материал плафонов:Хрусталь||Вид рассеивателя:Плафон||Форма рассеивателя:Декоративный||Цвет:Хром||Цвет арматуры:Хром||Цвет плафонов:Прозрачный||Степень защиты:IP20||Интерьер:Для больших залов||Место установки:На пол||Гарантия производителя:12 месяцев||Гарантия магазина:12 месяцев||Раздел:Торшеры||Каталог:С 1 плафоном
Торшер Arte Lamp Elba A2581PN-1CC;A2581PN-1CC;Arte Lamp;Италия;Торшеры;С 1 плафоном;11990;https://www.vamsvet.ru/upload/iblock/533/vamsvet-torsher-arte-lamp-elba-a2581pn-1cc.jpeg|https://www.vamsvet.ru/upload/iblock/712/torsher-arte-lamp-elba-a2581pn-1cc-1.jpeg|https://www.vamsvet.ru/upload/iblock/8fa/torsher-arte-lamp-elba-a2581pn-1cc-2.jpeg|https://www.vamsvet.ru/upload/iblock/0cb/torsher-arte-lamp-elba-a2581pn-1cc-3.jpeg|https://www.vamsvet.ru/upload/iblock/c59/torsher-arte-lamp-elba-a2581pn-1cc-4.jpeg|https://www.vamsvet.ru/upload/iblock/533/vamsvet-torsher-arte-lamp-elba-a2581pn-1cc.jpeg|https://www.vamsvet.ru/upload/iblock/712/torsher-arte-lamp-elba-a2581pn-1cc-1.jpeg|https://www.vamsvet.ru/upload/iblock/8fa/torsher-arte-lamp-elba-a2581pn-1cc-2.jpeg|https://www.vamsvet.ru/upload/iblock/0cb/torsher-arte-lamp-elba-a2581pn-1cc-3.jpeg|https://www.vamsvet.ru/upload/iblock/c59/torsher-arte-lamp-elba-a2581pn-1cc-4.jpeg;Elba;Феноменальная модель A2581PN-1CC со встроенным выключателем от итальянской компании Arte Lamp относится к коллекции Elba и отлично подойдет для установки на пол спальни, оформленной в современном стиле. Торшер Arte Lamp Elba A2581PN-1CC с конусными плафонами осветит помещение площадью 3.3 кв. м. Производитель Arte Lamp рекомендует использовать для устройства лампы накаливания с цоколем E27 и мощностью 60 W. Прибор произведен с использованием материалов: текстиль, металл и ткань. Основным цветом товара является белый и хромовый. Торшер A2581PN-1CC продается по цене 11990 руб. Торопитесь сделать заказ в интернет-магазине ВамСвет.;Артикул:A2581PN-1CC||Бренд:Arte Lamp||Страна бренда:Италия||Страна производства:Китай||Коллекция:Elba||Стиль:Современный||Высота, мм:1500||Диаметр, мм:380||Тип цоколя:E27||Тип лампочки (основной):Накаливания||Количество ламп:1||Мощность лампы, W:60||Общая мощность, W:60||Площадь освещения, м2:3.3||Напряжение, V:220-240||Виды материалов:Текстильные||Материал арматуры:Металл||Материал плафонов:Ткань||Вид рассеивателя:Абажур||Форма рассеивателя:Конусный||Цвет:Белый||Цвет арматуры:Хром||Цвет плафонов:Белый||Степень защиты:IP20||Интерьер:Для спальни||Место установки:На пол||Наличие выключателя:Да||Гарантия производителя:12 месяцев||Гарантия магазина:12 месяцев||Раздел:Торшеры||Каталог:С 1 плафоном
Торшер Eglo Maronda 94995;94995;Eglo;Австрия;Торшеры;С 2 и более плафонами;14690;https://www.vamsvet.ru/upload/iblock/aec/vamsvet-torsher-eglo-maronda-94995.jpeg|https://www.vamsvet.ru/upload/iblock/aec/vamsvet-torsher-eglo-maronda-94995.jpeg|https://www.vamsvet.ru/upload/iblock/a3a/f4f99f6b-89f8-11e6-bde5-002590ec3f3b1.jpeg;Maronda;Изумительная модель 94995 со встроенным выключателем от австрийской компании Eglo относится к коллекции Maronda и отлично подойдет для установки на пол в гостиной, оформленной в современном стиле. Торшер Eglo Maronda 94995 с конусными плафонами осветит помещение площадью 6.7 кв. м. Производитель Eglo рекомендует использовать для устройства лампы накаливания с цоколем E14 и мощностью 40 W. Прибор произведен с использованием материалов: текстиль, металл и ткань. Основным цветом товара является черный и разноцветный. Торшер 94995 продается по цене 14690 руб. Торопитесь сделать заказ в интернет-магазине ВамСвет.;Артикул:94995||Бренд:Eglo||Страна бренда:Австрия||Страна производства:Китай||Коллекция:Maronda||Стиль:Современный||Ширина, мм:35||Высота, мм:1520||Длина, мм:275||Тип цоколя:E14||Тип лампочки (основной):Накаливания||Количество ламп:3||Мощность лампы, W:40||Общая мощность, W:120||Площадь освещения, м2:6.7||Напряжение, V:220-240||Виды материалов:Текстильные||Материал арматуры:Металл||Материал плафонов:Ткань||Вид рассеивателя:Абажур||Форма рассеивателя:Конусный||Цвет:Черный||Цвет арматуры:Черный||Цвет плафонов:Разноцветный||Степень защиты:IP20||Интерьер:Для гостиной||Место установки:На пол||Пульт ДУ:Нет||Наличие выключателя:Да||Гарантия производителя:2 года||Гарантия магазина:12 месяцев||Раздел:Торшеры||Каталог:С 2 и более плафонами
Торшер Eglo Up 2 82842;82842;Eglo;Австрия;Торшеры;С 2 и более плафонами;7690;https://www.vamsvet.ru/upload/iblock/928/vamsvet-torsher-eglo-up-2-82842.jpeg;Up;Изящная модель 82842 со встроенным выключателем от австрийской компании Eglo относится к коллекции Up и отлично подойдет для установки на пол кафе и ресторанов, оформленных в современном стиле. Торшер Eglo Up 2 82842 с полукруглыми плафонами осветит помещение площадью 6.7 кв. м. Производитель Eglo рекомендует использовать для устройства лампы накаливания с цоколем E27 и мощностью 60 W. Прибор произведен с использованием материалов: металл и пластик. Основным цветом товара является никелевый и белый. Торшер 2 82842 продается по цене 7690 руб. Торопитесь сделать заказ в интернет-магазине ВамСвет.;Артикул:82842||Бренд:Eglo||Страна бренда:Австрия||Страна производства:Китай||Коллекция:Up||Стиль:Современный||Высота, мм:1765||Диаметр, мм:275||Тип цоколя:E27||Тип цоколя (дополнительный):E14||Тип лампочки (основной):Накаливания||Тип лампочки (дополнительный):Энергосберегающая||Количество ламп:2||Мощность лампы, W:60||Общая мощность, W:85||Площадь освещения, м2:6.7||Напряжение, V:220-240||Виды материалов:Металлические||Материал арматуры:Металл||Материал плафонов:Пластик||Вид рассеивателя:Плафон||Форма рассеивателя:Полукруг||Цвет:Никель||Цвет арматуры:Никель||Цвет плафонов:Белый||Тип поверхности:Матовая||Степень защиты:IP20||Интерьер:Для кафе и ресторанов||Место установки:На пол||Пульт ДУ:Нет||Наличие выключателя:Да||Гарантия производителя:2 года||Гарантия магазина:12 месяцев||Раздел:Торшеры||Каталог:С 2 и более плафонами
